{
  "schemaVersion": "ppflight.template-catalog/v1",
  "catalogId": "ppflight-proxmox-templates",
  "catalogRevision": "2026-08-30.1",
  "issuedAt": "2026-08-29T17:20:00Z",
  "websitePath": "/vps/proxmox-templates",
  "items": [
    {
      "templateRef": "ubuntu-2204",
      "version": "22.04",
      "displayName": "Ubuntu 22.04 LTS",
      "aliases": ["ubuntu-22.04", "ubuntu-jammy"],
      "architecture": "amd64",
      "guestType": "qemu",
      "source": {
        "kind": "official-cloud-image",
        "urlKey": "ubuntu-jammy-release-amd64",
        "sha256": "c0a5af17e6c0f76351fe07e2fffef3011dab1facb8a8ed5701dcf648dabd4f0a",
        "format": "qcow2",
        "upstreamChecksum": {
          "algorithm": "sha256",
          "value": "c0a5af17e6c0f76351fe07e2fffef3011dab1facb8a8ed5701dcf648dabd4f0a"
        }
      },
      "target": {
        "vmid": 9000,
        "osType": "l26",
        "diskBus": "scsi0",
        "agentEnabled": true
      },
      "minimumBytes": 734972416,
      "build": {
        "family": "debian",
        "templateName": "ubuntu-2204",
        "placeholderIPv4": "192.0.2.1",
        "description": "Ubuntu 22.04 LTS official released cloud image"
      }
    },
    {
      "templateRef": "ubuntu-2404",
      "version": "24.04",
      "displayName": "Ubuntu 24.04 LTS",
      "aliases": ["ubuntu-24.04", "ubuntu-noble"],
      "architecture": "amd64",
      "guestType": "qemu",
      "source": {
        "kind": "official-cloud-image",
        "urlKey": "ubuntu-noble-release-amd64",
        "sha256": "d0fe84bb5f80853425fa6be28e2c106f30104c3cfe8611933f2e65c9b63f0e30",
        "format": "qcow2",
        "upstreamChecksum": {
          "algorithm": "sha256",
          "value": "d0fe84bb5f80853425fa6be28e2c106f30104c3cfe8611933f2e65c9b63f0e30"
        }
      },
      "target": {
        "vmid": 9001,
        "osType": "l26",
        "diskBus": "scsi0",
        "agentEnabled": true
      },
      "minimumBytes": 624829952,
      "build": {
        "family": "debian",
        "templateName": "ubuntu-2404",
        "placeholderIPv4": "192.0.2.2",
        "description": "Ubuntu 24.04 LTS official released cloud image"
      }
    },
    {
      "templateRef": "almalinux-8",
      "version": "8",
      "displayName": "AlmaLinux 8",
      "aliases": ["alma-8", "alma8"],
      "architecture": "amd64",
      "guestType": "qemu",
      "source": {
        "kind": "official-cloud-image",
        "urlKey": "almalinux-8-genericcloud-amd64",
        "sha256": "301873ffbea203cf4e3e77970c8a26eab7e4a3afe7784e0a253a0f3d3dccfab9",
        "format": "qcow2",
        "upstreamChecksum": {
          "algorithm": "sha256",
          "value": "301873ffbea203cf4e3e77970c8a26eab7e4a3afe7784e0a253a0f3d3dccfab9"
        }
      },
      "target": {
        "vmid": 9002,
        "osType": "l26",
        "diskBus": "scsi0",
        "agentEnabled": true
      },
      "minimumBytes": 1630273536,
      "build": {
        "family": "rhel",
        "templateName": "almalinux-8",
        "placeholderIPv4": "192.0.2.3",
        "description": "AlmaLinux 8 official GenericCloud image"
      }
    },
    {
      "templateRef": "debian-13",
      "version": "13",
      "displayName": "Debian 13",
      "aliases": ["debian-trixie", "trixie"],
      "architecture": "amd64",
      "guestType": "qemu",
      "source": {
        "kind": "official-cloud-image",
        "urlKey": "debian-13-generic-amd64",
        "sha256": "ba8c002cbb083698e652b6853a5d1ef78e73f07ac8510dff7563de812c56789f",
        "format": "qcow2",
        "upstreamChecksum": {
          "algorithm": "sha512",
          "value": "720d9a2d21167e8aa1bb86a8a816658c7beaeec6975c376e15a0761383a869a466cbf7fe11c287c989020070309889dd81c37cd412290531245e3562334e05f3"
        }
      },
      "target": {
        "vmid": 9003,
        "osType": "l26",
        "diskBus": "scsi0",
        "agentEnabled": true
      },
      "minimumBytes": 433651712,
      "build": {
        "family": "debian",
        "templateName": "debian-13",
        "placeholderIPv4": "192.0.2.4",
        "description": "Debian 13 official GenericCloud image"
      }
    },
    {
      "templateRef": "debian-12",
      "version": "12",
      "displayName": "Debian 12",
      "aliases": ["debian-bookworm", "bookworm"],
      "architecture": "amd64",
      "guestType": "qemu",
      "source": {
        "kind": "official-cloud-image",
        "urlKey": "debian-12-generic-amd64",
        "sha256": "5b3a3ebcf65bddee9a7eb666f47dee50745a269947929875bd72259bd27e26d8",
        "format": "qcow2",
        "upstreamChecksum": {
          "algorithm": "sha512",
          "value": "ee13344d530f70ca055d880e5c9b61e9af89874af02c5e2a5c26724461c79409e6d76db97c67ab222e71d03c3e33a738a8958fa5c497962f592258e9835cfcb0"
        }
      },
      "target": {
        "vmid": 9004,
        "osType": "l26",
        "diskBus": "scsi0",
        "agentEnabled": true
      },
      "minimumBytes": 449511424,
      "build": {
        "family": "debian",
        "templateName": "debian-12",
        "placeholderIPv4": "192.0.2.5",
        "description": "Debian 12 official GenericCloud image"
      }
    },
    {
      "templateRef": "centos-stream-9",
      "version": "9-stream",
      "displayName": "CentOS Stream 9",
      "aliases": ["centos-9-stream", "centos9-stream"],
      "architecture": "amd64",
      "guestType": "qemu",
      "source": {
        "kind": "official-cloud-image",
        "urlKey": "centos-stream-9-genericcloud-amd64",
        "sha256": "9bc2838008fc212eb9b7c7fdf6ea26f572afdeeaa254fa973ef5cd528b87adcf",
        "format": "qcow2",
        "upstreamChecksum": {
          "algorithm": "sha256",
          "value": "9bc2838008fc212eb9b7c7fdf6ea26f572afdeeaa254fa973ef5cd528b87adcf"
        }
      },
      "target": {
        "vmid": 9005,
        "osType": "l26",
        "diskBus": "scsi0",
        "agentEnabled": true
      },
      "minimumBytes": 1277493248,
      "build": {
        "family": "rhel",
        "templateName": "centos-stream-9",
        "placeholderIPv4": "192.0.2.6",
        "description": "CentOS Stream 9 official GenericCloud image; requires x86-64-v2"
      }
    },
    {
      "templateRef": "centos-stream-10",
      "version": "10-stream",
      "displayName": "CentOS Stream 10",
      "aliases": ["centos-10-stream", "centos10-stream"],
      "architecture": "amd64",
      "guestType": "qemu",
      "source": {
        "kind": "official-cloud-image",
        "urlKey": "centos-stream-10-genericcloud-amd64",
        "sha256": "9cff5cbfd35c0c9070619c83ce9cad65d4eab845c9b83fb72c1b9209453d085b",
        "format": "qcow2",
        "upstreamChecksum": {
          "algorithm": "sha256",
          "value": "9cff5cbfd35c0c9070619c83ce9cad65d4eab845c9b83fb72c1b9209453d085b"
        }
      },
      "target": {
        "vmid": 9006,
        "osType": "l26",
        "diskBus": "scsi0",
        "agentEnabled": true
      },
      "minimumBytes": 1047003136,
      "build": {
        "family": "rhel",
        "templateName": "centos-stream-10",
        "placeholderIPv4": "192.0.2.7",
        "description": "CentOS Stream 10 official GenericCloud image; requires x86-64-v3"
      }
    }
  ]
}
